{
    "$schema": "http://json-schema.org/draft-06/schema#",
    "$ref": "#/definitions/Welcome2",
    "definitions": {
        "Welcome2": {
            "type": "object",
            "additionalProperties": false,
            "properties": {
                "messageid": {
                    "type": "integer"
                },
                "name": {
                    "type": "string"
                },
                "email": {
                    "type": "string"
                },
                "phone": {
                    "type": "string"
                },
                "subject": {
                    "type": "string"
                },
                "description": {
                    "type": "string"
                }
            },
            "required": [
                "description",
                "email",
                "messageid",
                "name",
                "phone",
                "subject"
            ],
            "title": "Welcome2"
        }
    }
}
