{"messageid":2,"name":"Gaurav Khandelwal","email":"gkhandelwal3@gmail.com","phone":"918767867687687","subject":"TEST Case 1 TEST Case 1 TEST Case 1 TEST Case 1 TEST Case 1 ","description":"TEST Case 1 TEST Case 1 TEST Case 1 TEST Case 1 TEST Case 1 TEST Case 1 TEST Case 1 TEST Case 1 TEST Case 1 TEST Case 1 TEST Case 1 TEST Case 1 TEST Case 1 TEST Case 1 TEST Case 1 TEST Case 1 "}